{
  "version": 1,
  "invocableLifecycles": ["core", "on-demand"],
  "activationRecords": [],
  "governanceChangeRecords": [],
  "transitions": [
    {
      "from": "unregistered",
      "to": "deferred",
      "requiredEvidence": [
        "approved-task-contract",
        "capability-need",
        "risk-review"
      ],
      "approvalGate": "product-owner-and-github-protected-review"
    },
    {
      "from": "unregistered",
      "to": "experimental",
      "requiredEvidence": [
        "approved-task-contract",
        "isolated-evaluation-plan",
        "risk-review",
        "safe-fallback"
      ],
      "approvalGate": "product-owner-and-github-protected-review"
    },
    {
      "from": "deferred",
      "to": "on-demand",
      "requiredEvidence": [
        "approved-task-contract",
        "capability-need",
        "risk-review",
        "agent-definition",
        "verification-evidence"
      ],
      "approvalGate": "product-owner-and-github-protected-review"
    },
    {
      "from": "experimental",
      "to": "on-demand",
      "requiredEvidence": [
        "evaluation-results",
        "risk-review",
        "safe-fallback",
        "verification-evidence"
      ],
      "approvalGate": "product-owner-and-github-protected-review"
    },
    {
      "from": "on-demand",
      "to": "core",
      "requiredEvidence": [
        "repeated-capability-need",
        "risk-review",
        "verification-evidence"
      ],
      "approvalGate": "product-owner-and-github-protected-review"
    },
    {
      "from": "core",
      "to": "retired",
      "requiredEvidence": [
        "replacement-owner",
        "handoff-plan",
        "historical-reference-plan"
      ],
      "approvalGate": "product-owner-and-github-protected-review"
    },
    {
      "from": "on-demand",
      "to": "retired",
      "requiredEvidence": ["replacement-owner", "historical-reference-plan"],
      "approvalGate": "product-owner-and-github-protected-review"
    },
    {
      "from": "deferred",
      "to": "retired",
      "requiredEvidence": ["retirement-reason", "historical-reference-plan"],
      "approvalGate": "product-owner-and-github-protected-review"
    },
    {
      "from": "experimental",
      "to": "retired",
      "requiredEvidence": ["evaluation-results", "historical-reference-plan"],
      "approvalGate": "product-owner-and-github-protected-review"
    }
  ],
  "externalEnforcement": "GitHub CODEOWNERS, branch protection, required reviews, and protected environments",
  "repositoryRecordPurpose": "Audit and deterministic consistency only; repository records do not authenticate human approval."
}
